<?xml version="1.0" encoding="UTF-8"?>

<uczelnia xmlns:xsi="http://www.w3.org/2001/XMLSchema-instance"
xsi:noNamespaceSchemaLocation="uczelnia.xsd">
    <listaStudentow>
        <student grupa="I" pozycjaWGrupie="10">
            <nazwisko>Kowalski</nazwisko>
            <imie>Jan</imie>
            <nrIndeksu>347</nrIndeksu>
            <wydzialStudent>3499</wydzialStudent>
        </student>
        <student grupa="I" pozycjaWGrupie="11">
            <nazwisko>Nowak</nazwisko>
            <imie>Anna</imie>
            <nrIndeksu>536</nrIndeksu>
            <wydzialStudent>3499</wydzialStudent>
        </student>
        <student grupa="IV" pozycjaWGrupie="2">
            <nazwisko>Leonowski</nazwisko>
            <imie>Leon</imie>
            <nrIndeksu>876</nrIndeksu>
            <wydzialStudent>3122</wydzialStudent>
        </student>
        <student grupa="I" pozycjaWGrupie="10">
            <nazwisko>Leonowski</nazwisko>
            <imie>Linus</imie>
            <nrIndeksu>832</nrIndeksu>
            <wydzialStudent>3122</wydzialStudent>
        </student>
        <student grupa="V" pozycjaWGrupie="8">
            <nazwisko>Lepek</nazwisko>
            <imie>Linus</imie>
            <nrIndeksu>811</nrIndeksu>
            <wydzialStudent>2211</wydzialStudent>
        </student>
    </listaStudentow>

    <wydzial numerWydzialu="3499">
        <nazwa>Wydział Informatyki i Zarządzania</nazwa>
    </wydzial>
    <wydzial numerWydzialu="3122">
        <nazwa>Wydział Elektroniki</nazwa>
    </wydzial>
    <wydzial numerWydzialu="2211">
        <nazwa>Wydział Archologii</nazwa>
    </wydzial>
</uczelnia>
